id;nome;descricao;classificacao;longevidade 
1;Orquídea Celestial;Possui pétalas que mudam de cor suavemente ao longo do dia, refletindo as nuances do céu durante o amanhecer e o anoitecer.;colorida;
2;Flor do Luar;Emite uma fragrância suave e relaxante durante a noite, atraindo polinizadores noturnos e criando uma atmosfera tranquila no jardim.;colorida;
3;Rosa Encantada;Suas pétalas têm uma textura aveludada e um padrão único que lembra delicadas rendas, dando-lhe uma aparência encantadora e elegante.;colorida;
4;Orquídea Esmeralda;As folhas desta orquídea têm uma tonalidade verde intensa e brilhante, criando um contraste deslumbrante com suas flores coloridas.;não colorida;
5;Brilho da Aurora;Ao ser exposta à luz do sol, suas pétalas brilham suavemente, criando um efeito deslumbrante que lembra as cores da aurora boreal.;colorida;
6;Pétalas de Seda;As pétalas têm uma textura sedosa e delicada, proporcionando uma experiência tátil única ao toque.;não colorida;
7;Encanto Violeta;Suas flores exibem uma tonalidade de violeta profunda e misteriosa, emanando uma aura de elegância e mistério no jardim.;colorida;
